<?xml version="1.0" encoding="UTF-8"?>

<!DOCTYPE network SYSTEM "network.dtd">

<network>
	<!-- This is the beastly computer that runs the show -->
	<computer>
		<name>Tropism</name>
		<objective>Core server</objective>
		<arch subarch="PentiumPro">i686</arch>
		<os release="stable" nickname="woody" revision="3.0r2">Debian GNU/Linux</os>
		<services network="IP">
			<service>
				<transport port="80">TCP</transport>
				<application>HTTP</application>
			</service>
		</services>
	</computer>
</network>
